title,description,published,link,media,desc_tokens,text,topic
"韓대행, 상호관세 유예에 “90일간 협상 진전시켜 부담 벗어날 것”",한덕수 대통령 권한대행 국무총리는 미국이 한국에 부과하는 25의 상호관세가 90일간 10로 낮아진 데 대해 앞으로 90일 동안 모든 협상에 진전을 보여서 관세의 부담으로부터 벗어나도록 더욱더 노력해야 된다고 말했다한 권한대행은 10일 오전 정부서울청사에서 열린 국정현안관계장관회의에서 미국의 상호 관세 유예 조치에 대해 무역에 성장과 발전을 많이 기대고 있는 대한민국이라며 다소 위안이 되는 소식이라고 말했다 앞서 도널드 트럼프 미국 대통령은 중국을 제외한 국가의 경우 국가별 상호 관세를 90일간 유예하고 10의 기본 관세만 부과하겠다고 밝힌 바 있다한 권한대행은 기본적으로 미국이 한국에 상호관세 25를 매기고자 하는 근거는 모든 제품 간의 경쟁 조건이 같지 않다고 판단하기 때문에 그 차액을 관세로서 부과한다는 취지라며 따라서 우리나라의 관세 수준 여러 가지 세제세금 수준 그리고 비관세 장벽 위생 이런 것들이 다 한꺼번에 포함이 돼 있다고 설명했다,2025-04-10 11:07:00,https://www.donga.com/news/Politics/article/all/20250410/131386823/2,동아닷컴,"['한덕수', '대통령', '권한', '대행', '국무총리', '미국', '한국', '부과', '25', '상호', '관세', '90', '10', '대하', '90', '모든', '협상', '진전', '보이', '어서', '관세', '부담', '으로부터', '벗어나', '도록', '노력', 'ㄴ다고', '권한', '대행', '10', '오전', '정부서울청사', '열리', '국정', '현안', '관계', '장관', '회의', '미국', '상호', '관세', '유예', '조치', '대하', '무역', '성장', '발전', '많이', '기대', '대한민국', '라며', '위안', '소식', '라고', '앞서', '도널드', '트럼프', '미국', '대통령', '중국', '제외', '국가', '경우', '국가', '상호', '관세', '90', '유예', '10', '기본', '관세', '부과', '다고', '밝히', '권한', '대행', '기본', '미국', '한국', '상호', '관세', '25', '매기', '고자', '근거', '모든', '제품', '경쟁', '조건', '다고', '판단', '때문', '차액', '관세', '로서', '부과', 'ㄴ다는', '취지', '라며', '우리나라', '관세', '수준', '여러', '가지', '세제', '세금', '수준', '관세', '장벽', '위생', '한꺼번에', '포함', '다고', '설명']","韓대행, 상호관세 유예에 “90일간 협상 진전시켜 부담 벗어날 것” 한덕수 대통령 권한대행 국무총리는 미국이 한국에 부과하는 25의 상호관세가 90일간 10로 낮아진 데 대해 앞으로 90일 동안 모든 협상에 진전을 보여서 관세의 부담으로부터 벗어나도록 더욱더 노력해야 된다고 말했다한 권한대행은 10일 오전 정부서울청사에서 열린 국정현안관계장관회의에서 미국의 상호 관세 유예 조치에 대해 무역에 성장과 발전을 많이 기대고 있는 대한민국이라며 다소 위안이 되는 소식이라고 말했다 앞서 도널드 트럼프 미국 대통령은 중국을 제외한 국가의 경우 국가별 상호 관세를 90일간 유예하고 10의 기본 관세만 부과하겠다고 밝힌 바 있다한 권한대행은 기본적으로 미국이 한국에 상호관세 25를 매기고자 하는 근거는 모든 제품 간의 경쟁 조건이 같지 않다고 판단하기 때문에 그 차액을 관세로서 부과한다는 취지라며 따라서 우리나라의 관세 수준 여러 가지 세제세금 수준 그리고 비관세 장벽 위생 이런 것들이 다 한꺼번에 포함이 돼 있다고 설명했다",0
"민주 “한덕수, 美 요구 다 들어준 것 아닌가 의심…협상 믿을 수 없어”",진성준 더불어민주당 정책위의장은 10일 한덕수 대통령 권한대행 국무총리와 도널드 트럼프 미국 대통령이 통화한 것과 관련해 한 권한대행이 미국의 요구를 다 들어줘 버린 게 아니냐는 의심이 제기되고 한 권한대행의 대미 통상 협상을 믿을 수 없다는 말까지 나온다고 비판했다진 정책위의장은 이날 오전 국회에서 열린 정책조정회의에서 백악관은 통화 직후에 미국 노동자와 농민을 위해 정말 긍정적이었다고 하면서 테이블에서 정말 많은 양보가 있었다고 평가했다며 이같이 말했다진 정책위의장은 우리 측 요청으로 성사된 게 아니라 미국 측 요청으로 통화가 이뤄졌다고 한다며 미국 측에서 흘러나오는 얘기를 보면 국민이 불안하다 트럼프의 원스톱 쇼핑이란 말에서 보듯 미국은 한국의 무역 흑자 관세 조선업 LNG액화천연가스 방위비 분담금 등 자신이 원하는 모든 사안을 쏟아낸 것 같다고 우려했다그러면서 트럼프의 핵심 관심 사항은 수용 가능한 부분을 가려 우선적으로 적극적으로 대응해,2025-04-10 10:14:00,https://www.donga.com/news/Politics/article/all/20250410/131386286/1,동아닷컴,"['진성준', '더불어민주당', '정책위', '의장', '10', '한덕수', '대통령', '권한', '대행', '국무총리', '도널드', '트럼프', '미국', '대통령', '통화', '관련', '권한', '대행', '미국', '요구', '버리', '냐는', '의심', '제기', '권한', '대행', '대미', '통상', '협상', '다는', '나오', 'ㄴ다고', '비판', '정책위', '의장', '이날', '오전', '국회', '열리', '정책', '조정', '회의', '백악관', '통화', '직후', '미국', '노동자', '농민', '위하', '정말', '긍정', '다고', '면서', '테이블', '정말', '양보', '다고', '평가', '다며', '정책위', '의장', '요청', '성사', '미국', '요청', '통화', '이뤄지', '다고', 'ㄴ다며', '미국', '흘러나오', '얘기', '국민', '불안', '트럼프', '원스톱', '쇼핑', '이란', '미국', '한국', '무역', '흑자', '관세', '조선업', 'LNG', '액화', '천연가스', '방위비', '분담금', '모든', '사안', '다고', '우려', '그러', '면서', '트럼프', '핵심', '관심', '사항', '수용', '가능', '부분', '가리', '적극', '대응']","민주 “한덕수, 美 요구 다 들어준 것 아닌가 의심…협상 믿을 수 없어” 진성준 더불어민주당 정책위의장은 10일 한덕수 대통령 권한대행 국무총리와 도널드 트럼프 미국 대통령이 통화한 것과 관련해 한 권한대행이 미국의 요구를 다 들어줘 버린 게 아니냐는 의심이 제기되고 한 권한대행의 대미 통상 협상을 믿을 수 없다는 말까지 나온다고 비판했다진 정책위의장은 이날 오전 국회에서 열린 정책조정회의에서 백악관은 통화 직후에 미국 노동자와 농민을 위해 정말 긍정적이었다고 하면서 테이블에서 정말 많은 양보가 있었다고 평가했다며 이같이 말했다진 정책위의장은 우리 측 요청으로 성사된 게 아니라 미국 측 요청으로 통화가 이뤄졌다고 한다며 미국 측에서 흘러나오는 얘기를 보면 국민이 불안하다 트럼프의 원스톱 쇼핑이란 말에서 보듯 미국은 한국의 무역 흑자 관세 조선업 LNG액화천연가스 방위비 분담금 등 자신이 원하는 모든 사안을 쏟아낸 것 같다고 우려했다그러면서 트럼프의 핵심 관심 사항은 수용 가능한 부분을 가려 우선적으로 적극적으로 대응해",0
"러 파병 북한군, 괴혈병 앓아…“개고기 먹는 애들” 인종차별도 겪어",우크라이나 전선에 투입된 북한군 병사들이 자신들이 왜 전쟁에 나왔는지도 모른 채 괴혈병에 시달리고 러시아군의 인종차별까지 겪은 것으로 확인됐다8일 월스트리트저널WSJ은 우크라이나군과 북한군 포로들의 증언을 인용해 북한군의 전투 상황과 처우를 알렸다포로가 된 26세 병사 리모는 왜 전쟁에 나갔는지도 몰랐다 우크라이나군에 남한군이 포함된 줄 알았다고 증언했다 일부 포로는 전쟁에 파견된 이유도 모른 채 남한군이 우크라이나 편에 있는 것으로 착각하고 있던 것이다우크라이나군은 생포한 북한군의 모발과 구강 샘플을 분석했다 그 결과 상당수 병사에게서 비타민C 결핍으로 인한 괴혈병 증상이 나타났다일부는 수류탄 대신 값싼 소시지를 수류탄 주머니에 넣고 있었던 것으로 확인돼 무장조차 제대로 갖추지 못한 상태에서 전투에 투입된 정황이 포착됐다또 우크라이나군은 러시아군의 내부 무전 내용을 도청해 북한군에 대한 조롱과 멸시가 오갔다는 사실도 확인했다한 러시아 병사는 누가 아,2025-04-10 10:05:00,https://www.donga.com/news/Politics/article/all/20250410/131386271/2,동아닷컴,"['우크라이나', '전선', '투입', '북한군', '병사', '전쟁', '나오', '는지', '모르', '괴혈병', '시달리', '러시아군', '인종', '차별', '확인', '월스트리트저널WSJ', '우크라이나군', '북한군', '포로', '증언', '인용', '북한군', '전투', '상황', '처우', '알리', '포로', '26', '병사', '리모', '전쟁', '나가', '는지', '모르', '우크라이나군', '남한군', '포함', '다고', '증언', '일부', '포로', '전쟁', '파견', '이유', '모르', '남한군', '우크라이나', '착각', '다우크라이나군', '생포', '북한군', '모발', '구강', '샘플', '분석', '결과', '상당수', '병사', '에게서', '비타민', '결핍', '인하', '괴혈병', '증상', '나타나', '일부', '수류탄', '대신', '값싸', '소시지', '수류탄', '주머니', '확인', '무장', '제대로', '갖추', '못하', '상태', '전투', '투입', '정황', '포착', '우크라이나군', '러시아군', '내부', '무전', '내용', '도청', '북한군', '대하', '조롱', '멸시', '오가', '다는', '사실', '확인', '러시아', '병사']","러 파병 북한군, 괴혈병 앓아…“개고기 먹는 애들” 인종차별도 겪어 우크라이나 전선에 투입된 북한군 병사들이 자신들이 왜 전쟁에 나왔는지도 모른 채 괴혈병에 시달리고 러시아군의 인종차별까지 겪은 것으로 확인됐다8일 월스트리트저널WSJ은 우크라이나군과 북한군 포로들의 증언을 인용해 북한군의 전투 상황과 처우를 알렸다포로가 된 26세 병사 리모는 왜 전쟁에 나갔는지도 몰랐다 우크라이나군에 남한군이 포함된 줄 알았다고 증언했다 일부 포로는 전쟁에 파견된 이유도 모른 채 남한군이 우크라이나 편에 있는 것으로 착각하고 있던 것이다우크라이나군은 생포한 북한군의 모발과 구강 샘플을 분석했다 그 결과 상당수 병사에게서 비타민C 결핍으로 인한 괴혈병 증상이 나타났다일부는 수류탄 대신 값싼 소시지를 수류탄 주머니에 넣고 있었던 것으로 확인돼 무장조차 제대로 갖추지 못한 상태에서 전투에 투입된 정황이 포착됐다또 우크라이나군은 러시아군의 내부 무전 내용을 도청해 북한군에 대한 조롱과 멸시가 오갔다는 사실도 확인했다한 러시아 병사는 누가 아",0
"권한대행 60일 이후 새 정부 변수…대미 정책 전반 일관성 유지 중요 [美, 상호관세 유예]",한국 정부가 결국 관세 주한미군 방위비 분담금 등을 놓고 도널드 트럼프 2기 미국 행정부의 압박 전략을 상대하게 됐다 경제와 안보 문제가 뒤섞인 복잡한 협상이 될 전망인데 대통령 대행 체제로 미국과 협상을 진행하고 새로 들어서는 정부가 이를 이어받아야 하는 녹록지 않은 상황이 됐다 정권 이양기에 대미 정책을 비롯한 외교안보 정책 전반의 일관성이 중,2025-04-10 19:00:00,https://www.segye.com/newsView/20250410517433,세계일보,"['한국', '정부', '관세', '주한', '미군', '방위비', '분담금', '도널드', '트럼프', '미국', '행정부', '압박', '전략', '상대', '경제', '안보', '문제', '뒤섞이', '복잡하', '협상', '전망', 'ㄴ데', '대통령', '대행', '체제', '미국', '협상', '진행', '새로', '들어서', '정부', '이어받', '녹록하', '상황', '정권', '이양기', '대미', '정책', '비롯하', '외교', '안보', '정책', '전반', '일관']","권한대행 60일 이후 새 정부 변수…대미 정책 전반 일관성 유지 중요 [美, 상호관세 유예] 한국 정부가 결국 관세 주한미군 방위비 분담금 등을 놓고 도널드 트럼프 2기 미국 행정부의 압박 전략을 상대하게 됐다 경제와 안보 문제가 뒤섞인 복잡한 협상이 될 전망인데 대통령 대행 체제로 미국과 협상을 진행하고 새로 들어서는 정부가 이를 이어받아야 하는 녹록지 않은 상황이 됐다 정권 이양기에 대미 정책을 비롯한 외교안보 정책 전반의 일관성이 중",0
"‘패키지딜’ 또 꺼낸 트럼프… “부담 공유 늘려야” [美, 상호관세 유예]",도널드 트럼프 미국 대통령이 주한미군 주둔과 방위비 분담금 등 안보 문제를 상호관세와 같은 무역 이슈와 한데 묶어 패키지로 협상하겠다는 입장을 재차 밝혔다 한미 협상 판이 커지면서 동맹관계를 거래 대상으로 여기는 트럼프 대통령의 압박도 더욱 거세질 전망이다 트럼프 대통령은 9일현지시간 백악관 집무실에서 진행한 행정명령 서명 행사에서 유럽이나,2025-04-10 18:20:00,https://www.segye.com/newsView/20250410517479,세계일보,"['도널드', '트럼프', '미국', '대통령', '주한', '미군', '주둔', '방위비', '분담금', '안보', '문제', '상호', '관세', '무역', '이슈', '패키지', '협상', '다는', '입장', '재차', '밝히', '협상', '커지', '면서', '동맹', '관계', '거래', '대상', '트럼프', '대통령', '압박', '더욱', '거세지', '전망', '트럼프', '대통령', '현지', '백악관', '집무실', '진행', '행정', '명령', '서명', '행사', '유럽', '이나']","‘패키지딜’ 또 꺼낸 트럼프… “부담 공유 늘려야” [美, 상호관세 유예] 도널드 트럼프 미국 대통령이 주한미군 주둔과 방위비 분담금 등 안보 문제를 상호관세와 같은 무역 이슈와 한데 묶어 패키지로 협상하겠다는 입장을 재차 밝혔다 한미 협상 판이 커지면서 동맹관계를 거래 대상으로 여기는 트럼프 대통령의 압박도 더욱 거세질 전망이다 트럼프 대통령은 9일현지시간 백악관 집무실에서 진행한 행정명령 서명 행사에서 유럽이나",0
"韓·美, 새 작계 서명 공개… 북핵 대응 강화",한미가 고도화되는 북한 위협에 맞설 새 연합 작전계획에 서명한 사실을 처음 공개했다 제이비어 브런슨 한미연합사령관 겸 주한미군사령관은 9일현지시간 미 하원 군사위원회 청문회에 맞춰 의원들에게 제출한 성명에서 새로운 전투 준비 태세에서 중요한 진전을 이뤘다며 새로운 연합 작전계획OPLAN에 서명했다고 밝혔다 브런슨 사령관은 지난 몇 년,2025-04-10 17:58:00,https://www.segye.com/newsView/20250410517589,세계일보,"['고도', '북한', '위협', '맞서', '연합', '작전', '계획', '서명', '사실', '처음', '공개', '제이비어', '브런슨', '한미', '연합', '사령관', '주한', '미군', '사령관', '현지', '하원', '군사', '위원회', '청문회', '맞추', '의원', '제출', '성명', '새롭', '전투', '준비', '태세', '중요', '진전', '이루', '다며', '새롭', '연합', '작전', '계획', 'OPLAN', '서명', '다고', '밝히', '브런슨', '사령관', '지나']","韓·美, 새 작계 서명 공개… 북핵 대응 강화 한미가 고도화되는 북한 위협에 맞설 새 연합 작전계획에 서명한 사실을 처음 공개했다 제이비어 브런슨 한미연합사령관 겸 주한미군사령관은 9일현지시간 미 하원 군사위원회 청문회에 맞춰 의원들에게 제출한 성명에서 새로운 전투 준비 태세에서 중요한 진전을 이뤘다며 새로운 연합 작전계획OPLAN에 서명했다고 밝혔다 브런슨 사령관은 지난 몇 년",0
김영호 통일장관 “국제사회 뜻 모으면 北 비핵화 가능”,일본을 방문 중인 김영호 통일부 장관은 10일 북한의 완전한 비핵화가 불가능한 목표처럼 보일지라도 국제사회가 뜻을 모으면 길이 열릴 것이라고 강조했다 김 장관은 이날 일본 도쿄에서 열린 외국특파원협회 대상 통일대북 정책 설명회에 참석해 북한은 위협과 도발의 수위를 높이며 한반도를 넘어 세계 평화와 안정에 실존적 위협이 되고 있다며 이같이 밝혔,2025-04-10 17:51:00,https://www.segye.com/newsView/20250410517932,세계일보,"['일본', '방문', '김영호', '통일부', '장관', '10', '북한', '완전', '가능', '목표', '처럼', '보이', 'ㄹ지라도', '국제', '사회', '모으', '열리', '라고', '강조', '장관', '이날', '일본', '도쿄', '열리', '외국특파원협회', '대상', '통일', '대북', '정책', '설명회', '참석', '북한', '위협', '도발', '수위', '높이', '한반도', '세계', '평화', '안정', '실존', '위협', '다며', '밝히']",김영호 통일장관 “국제사회 뜻 모으면 北 비핵화 가능” 일본을 방문 중인 김영호 통일부 장관은 10일 북한의 완전한 비핵화가 불가능한 목표처럼 보일지라도 국제사회가 뜻을 모으면 길이 열릴 것이라고 강조했다 김 장관은 이날 일본 도쿄에서 열린 외국특파원협회 대상 통일대북 정책 설명회에 참석해 북한은 위협과 도발의 수위를 높이며 한반도를 넘어 세계 평화와 안정에 실존적 위협이 되고 있다며 이같이 밝혔,0
"[속보] 韓대행, 美상호관세 유예에 “협상 진전시켜 부담 벗도록 노력”",한덕수 대통령 권한대행 국무총리는 미국의 상호관세 부과 유예 조치에 대해 앞으로 90일 동안 모든 협상에 진전을 보여서 관세의 부담으로부터 벗어나도록 더욱더 노력해야 한다고 강,2025-04-10 10:37:00,https://www.mk.co.kr/news/politics/11287816,매일경제,"['한덕수', '대통령', '권한', '대행', '국무총리', '미국', '상호', '관세', '부과', '유예', '조치', '대하', '90', '모든', '협상', '진전', '보이', '어서', '관세', '부담', '으로부터', '벗어나', '도록', '노력', 'ㄴ다고']","[속보] 韓대행, 美상호관세 유예에 “협상 진전시켜 부담 벗도록 노력” 한덕수 대통령 권한대행 국무총리는 미국의 상호관세 부과 유예 조치에 대해 앞으로 90일 동안 모든 협상에 진전을 보여서 관세의 부담으로부터 벗어나도록 더욱더 노력해야 한다고 강",0
"주한미군사령관 “한미, 작년 새 연합작전계획 서명…北 WMD 대응 강화”",한미가 작년에 북한의 핵무기 고도화에 대응해 정비해 온 새로운 연합 작전계획에 서명했다고 제이비어 브런슨 주한미군사령관이 밝혔다 9일현지시간 연합뉴스에 따르면 한미연합군사령관,2025-04-10 06:09:00,https://www.mk.co.kr/news/politics/11287546,매일경제,"['작년', '북한', '핵무기', '고도', '대응', '정비', '새롭', '연합', '작전', '계획', '서명', '다고', '제이비어', '브런슨', '주한', '미군', '사령관', '밝히', '현지', '연합', '뉴스', '따르', '한미', '연합군', '사령관']","주한미군사령관 “한미, 작년 새 연합작전계획 서명…北 WMD 대응 강화” 한미가 작년에 북한의 핵무기 고도화에 대응해 정비해 온 새로운 연합 작전계획에 서명했다고 제이비어 브런슨 주한미군사령관이 밝혔다 9일현지시간 연합뉴스에 따르면 한미연합군사령관",0
[속보] 트럼프 “한국서도 방위비 보전못받아…무역협상 일부될 수도”,도널드 트럼프 미국 대통령은 주한미군 등 해외미군 감축 문제가 방위비 분담금과 연계될 수 있다고 시사하면서 방위비 분담금 문제를 무역 협상과 패키지로 논의하겠다는 취지로 언급했다,2025-04-10 05:58:00,https://www.mk.co.kr/news/politics/11287544,매일경제,"['도널드', '트럼프', '미국', '대통령', '주한', '미군', '해외', '미군', '감축', '문제', '방위비', '분담금', '연계', '다고', '시사', '면서', '방위비', '분담금', '문제', '무역', '협상', '패키지', '논의', '다는', '취지', '언급']",[속보] 트럼프 “한국서도 방위비 보전못받아…무역협상 일부될 수도” 도널드 트럼프 미국 대통령은 주한미군 등 해외미군 감축 문제가 방위비 분담금과 연계될 수 있다고 시사하면서 방위비 분담금 문제를 무역 협상과 패키지로 논의하겠다는 취지로 언급했다,0
"국힘 유용원, 산불 공중진화 체계 개선 방안 모색",10일 국가 산불재난대응체계 혁신을 위한 긴급세미나 초대형 산불 국방역량까지 포함한 총력대응 체계로 AI위성무인기 기반으로 정보역량 획기적 강화 필요기후위기 시대 산불은 더,2025-04-09 15:17:00,https://www.mk.co.kr/news/politics/11286973,매일경제,"['10', '국가', '산불', '재난', '대응', '체계', '혁신', '위하', '긴급', '세미나', '대형', '산불', '국방', '역량', '포함', '총력', '대응', '체계', 'AI', '위성', '무인기', '기반', '정보', '역량', '획기적', '강화', '필요', '기후', '위기', '시대', '산불']","국힘 유용원, 산불 공중진화 체계 개선 방안 모색 10일 국가 산불재난대응체계 혁신을 위한 긴급세미나 초대형 산불 국방역량까지 포함한 총력대응 체계로 AI위성무인기 기반으로 정보역량 획기적 강화 필요기후위기 시대 산불은 더",0
MB 예방한 김기문 중기중앙회장...세계한상대회 자문 구해,대미 경험 많은 이명박 전 대통령 예방 성공적인 대회 개최 자문 구해 한미 우호관계 강화방안도 논의  어려운 정국 꿋꿋이 역할해 달라김기문 중소기업중앙회장이 이명박,2025-04-09 14:55:00,https://www.mk.co.kr/news/business/11286921,매일경제,"['대미', '경험', '이명박', '대통령', '예방', '성공', '대회', '개최', '자문', '구하', '한미', '우호', '관계', '강화', '방안', '논의', '어렵', '정국', '꿋꿋이', '역할', '김기문', '중소기업', '중앙회장', '이명박']",MB 예방한 김기문 중기중앙회장...세계한상대회 자문 구해 대미 경험 많은 이명박 전 대통령 예방 성공적인 대회 개최 자문 구해 한미 우호관계 강화방안도 논의  어려운 정국 꿋꿋이 역할해 달라김기문 중소기업중앙회장이 이명박,0
"트럼프, 또 “방위비와 패키지 딜”…정부 협상 전략 재점검 필요",미군 위해 많은 돈 내지만 보전 못 받아협상의 일부 90일 유예로 시간 벌었지만일각 성급한 접근 안 돼 전문가 경제와 안보 이슈 분리 어려운 현실 직시해야 코스피 오르고 환율 내리고 도널드 트럼프 미국 대통령이 각국에 부과한 상호관세 적용을 유예한다고 밝힌 10일 서울 중구 하나은행 본점 딜링룸 현황판에 코스피 원달러 환율 코,2025-04-10 20:19:00,https://www.khan.co.kr/article/202504102019015/?utm_source=khan_rss&utm_medium=rss&utm_campaign=politic_news,경향닷컴,"['미군', '위하', '보전', '협상', '일부', '90', '유예', '성급하', '접근', '전문가', '경제', '안보', '이슈', '분리', '어렵', '현실', '직시', '코스피', '오르', '환율', '내리', '도널드', '트럼프', '미국', '대통령', '각국', '부과', '상호', '관세', '적용', '유예', 'ㄴ다고', '밝히', '10', '서울', '중구', '하나은행', '본점', '딜링룸', '현황판', '코스피', '달러', '환율']","트럼프, 또 “방위비와 패키지 딜”…정부 협상 전략 재점검 필요 미군 위해 많은 돈 내지만 보전 못 받아협상의 일부 90일 유예로 시간 벌었지만일각 성급한 접근 안 돼 전문가 경제와 안보 이슈 분리 어려운 현실 직시해야 코스피 오르고 환율 내리고 도널드 트럼프 미국 대통령이 각국에 부과한 상호관세 적용을 유예한다고 밝힌 10일 서울 중구 하나은행 본점 딜링룸 현황판에 코스피 원달러 환율 코",0
