title,description,published,link,media,desc_tokens,text,topic
"트럼프, 또 ‘관세·방위비’ 연계…‘패키지 협상’ 현실적 전략 필요",도널드 트럼프 미국 대통령 로이터 연합뉴스 도널드 트럼프 미국 대통령이 한국과의 관세 협상에서 주한미군 방위비 분담과 주둔 문제를 패키지로 다룰 수 있다는 입장을 재차 밝혔다 두 사안이 직접적으로 연계되는 것을 경계하는 한국 정부의 부담이 커졌다 미국이 상호관세 부과를 90일 유예한 만큼 미국 측 진의를 신중하게 파악해야 한다는 제언이 나왔다 경,2025-04-10 18:36:00,https://www.khan.co.kr/article/202504101836001/?utm_source=khan_rss&utm_medium=rss&utm_campaign=politic_news,경향닷컴,"['도널드', '트럼프', '미국', '대통령', '로이터', '연합뉴스', '도널드', '트럼프', '미국', '대통령', '한국', '관세', '협상', '주한', '미군', '방위비', '분담', '주둔', '문제', '패키지', '다루', '다는', '입장', '재차', '밝히', '사안', '직접', '연계', '경계', '한국', '정부', '부담', '커지', '미국', '상호', '관세', '부과', '90', '유예', '미국', '진의', '신중', '파악', 'ㄴ다는', '제언', '나오']","트럼프, 또 ‘관세·방위비’ 연계…‘패키지 협상’ 현실적 전략 필요 도널드 트럼프 미국 대통령 로이터 연합뉴스 도널드 트럼프 미국 대통령이 한국과의 관세 협상에서 주한미군 방위비 분담과 주둔 문제를 패키지로 다룰 수 있다는 입장을 재차 밝혔다 두 사안이 직접적으로 연계되는 것을 경계하는 한국 정부의 부담이 커졌다 미국이 상호관세 부과를 90일 유예한 만큼 미국 측 진의를 신중하게 파악해야 한다는 제언이 나왔다 경",0
한·미연합사령관 “새로운 작계 도입…주한미군은 핵심적”,미 하원 군사위원 청문회에서 서면답변 새 작계 도입은 북핵과 그 대응력 향상에 따라 한미 핵협의그룹 프리덤 에지 등 지속할 뜻 밝혀 제이비어 브런슨 한 미연합사령관주한미군사령관 유엔군사령관 겸직 미국 육군 제공 제이비어 브런슨 한미연합군사령관주한미군사령관유엔군사령관 겸직이 한반도 유사시 군사작전 계획인 작전계획을 새로 마련했다고 ,2025-04-10 18:14:00,https://www.khan.co.kr/article/202504101814011/?utm_source=khan_rss&utm_medium=rss&utm_campaign=politic_news,경향닷컴,"['하원', '군사', '위원', '청문회', '서면', '답변', '작계', '도입', '북핵', '대응력', '향상', '따르', '한미', '협의', '그룹', '프리덤', '에지', '지속', '밝히', '제이비어', '브런슨', '연합', '사령관', '주한', '미군', '사령관', '유엔군', '사령관', '겸직', '미국', '육군', '제공', '제이비어', '브런슨', '한미', '연합군', '사령관', '주한미군', '사령관', '유엔군', '사령관', '겸직', '한반도', '유사시', '군사', '작전', '계획', '작전', '계획', '새로', '마련', '다고']",한·미연합사령관 “새로운 작계 도입…주한미군은 핵심적” 미 하원 군사위원 청문회에서 서면답변 새 작계 도입은 북핵과 그 대응력 향상에 따라 한미 핵협의그룹 프리덤 에지 등 지속할 뜻 밝혀 제이비어 브런슨 한 미연합사령관주한미군사령관 유엔군사령관 겸직 미국 육군 제공 제이비어 브런슨 한미연합군사령관주한미군사령관유엔군사령관 겸직이 한반도 유사시 군사작전 계획인 작전계획을 새로 마련했다고 ,0
"한덕수, 미국 상호관세 유예에 “협상 진전시켜 부담 벗도록 노력”",국정현안관계장관회의 주재 장관들에 적극적인 규제완화 주문 한덕수 대통령 권한대행 겸 국무총리가 10일 서울 종로구 정부서울청사에서 열린 국정현안관계장관회의에서 모두발언을 하고 있다 대통령실사진기자단 한덕수 대통령 권한대행 겸 국무총리는 10일 미국의 상호관세 부과 유예 조치에 다소 위안이 되는 소식이라며 무역에 의존해 성장하는 대한민국으로서는 ,2025-04-10 14:30:00,https://www.khan.co.kr/article/202504101430001/?utm_source=khan_rss&utm_medium=rss&utm_campaign=politic_news,경향닷컴,"['국정', '현안', '관계', '장관', '회의', '주재', '장관', '적극', '규제', '완화', '주문', '한덕수', '대통령', '권한', '대행', '국무총리', '10', '서울', '종로구', '정부서울청사', '열리', '국정', '현안', '관계', '장관', '회의', '발언', '대통령실', '사진', '기자단', '한덕수', '대통령', '권한', '대행', '국무총리', '10', '미국', '상호', '관세', '부과', '유예', '조치', '위안', '소식', '라며', '무역', '의존', '성장', '대한민국']","한덕수, 미국 상호관세 유예에 “협상 진전시켜 부담 벗도록 노력” 국정현안관계장관회의 주재 장관들에 적극적인 규제완화 주문 한덕수 대통령 권한대행 겸 국무총리가 10일 서울 종로구 정부서울청사에서 열린 국정현안관계장관회의에서 모두발언을 하고 있다 대통령실사진기자단 한덕수 대통령 권한대행 겸 국무총리는 10일 미국의 상호관세 부과 유예 조치에 다소 위안이 되는 소식이라며 무역에 의존해 성장하는 대한민국으로서는 ",0
무인기와 헬기 충돌은 ‘돌풍 탓’…피해액 230억으로 집계돼,헤론과 수리온 충돌 조사결과 무인기 착륙 중 돌풍 불어 활주로에서 이탈 지난 3월 17일 경기도 양주 군 비행장에서 착륙하던 무인기 헤론이 지상에 있던 수리온 헬기와 충돌해 무인기와 헬기가 모두 불에 탔다 연합뉴스 지난달 육군 무인기 헤론이 착륙하다가 지상에 있던 수리온 헬기와 충돌한 사고의 원인은 갑자기 불어닥친 거센 바람 때,2025-04-10 14:12:00,https://www.khan.co.kr/article/202504101412001/?utm_source=khan_rss&utm_medium=rss&utm_campaign=politic_news,경향닷컴,"['헤론', '수리온', '충돌', '조사', '결과', '무인기', '착륙', '돌풍', '활주로', '이탈', '지나', '17', '경기도', '양주', '비행장', '착륙', '무인기', '헤론', '지상', '수리', '헬기', '충돌', '무인기', '헬기', '연합뉴스', '지난달', '육군', '무인기', '헤론', '착륙', '다가', '지상', '수리', '헬기', '충돌', '사고', '원인', '갑자기', '불어닥치', '거세', '바람']",무인기와 헬기 충돌은 ‘돌풍 탓’…피해액 230억으로 집계돼 헤론과 수리온 충돌 조사결과 무인기 착륙 중 돌풍 불어 활주로에서 이탈 지난 3월 17일 경기도 양주 군 비행장에서 착륙하던 무인기 헤론이 지상에 있던 수리온 헬기와 충돌해 무인기와 헬기가 모두 불에 탔다 연합뉴스 지난달 육군 무인기 헤론이 착륙하다가 지상에 있던 수리온 헬기와 충돌한 사고의 원인은 갑자기 불어닥친 거센 바람 때,0
"한덕수, 주미대사와 화상회의···“현지 소통 강화하고 충실히 보고해달라”",한덕수 대통령 권한대행 겸 국무총리가 10일 미국 상호 관세와 관련해 미국 현지에 파견된 정인교 통상교섭본부장 조현동 주미대사 등과 화상회의를 하며 관련 상황을 보고 받고 있다 국무총리실 제공 한덕수 대통령 권한대행 겸 국무총리는 10일 조현동 주미대사 방미 중인 정인교 통상교섭본부장과 화상회의를 통해 미국의 상호관세 부과에 대한 대응 방안을 논의했,2025-04-10 14:05:00,https://www.khan.co.kr/article/202504101405001/?utm_source=khan_rss&utm_medium=rss&utm_campaign=politic_news,경향닷컴,"['한덕수', '대통령', '권한', '대행', '국무총리', '10', '미국', '상호', '관세', '관련', '미국', '현지', '파견', '정인교', '통상', '교섭', '본부장', '조현동', '주미', '대사', '화상', '회의', '관련', '상황', '보고', '국무총리실', '제공', '한덕수', '대통령', '권한', '대행', '국무총리', '10', '조현동', '주미', '대사', '방미', '정인교', '통상', '교섭', '본부장', '화상', '회의', '통하', '미국', '상호', '관세', '부과', '대하', '대응', '방안', '논의']","한덕수, 주미대사와 화상회의···“현지 소통 강화하고 충실히 보고해달라” 한덕수 대통령 권한대행 겸 국무총리가 10일 미국 상호 관세와 관련해 미국 현지에 파견된 정인교 통상교섭본부장 조현동 주미대사 등과 화상회의를 하며 관련 상황을 보고 받고 있다 국무총리실 제공 한덕수 대통령 권한대행 겸 국무총리는 10일 조현동 주미대사 방미 중인 정인교 통상교섭본부장과 화상회의를 통해 미국의 상호관세 부과에 대한 대응 방안을 논의했",0
"통일부 “김여정 담화, 군축 시사해 대화 암시···트럼프에 간접 반응”",김여정 북한 노동당 부부장 조선중앙TV연합뉴스 통일부가 10일 김여정 북한 노동당 부부장의 완전한 비핵화 불가 담화에 대해 북한의 핵보유국을 인정하는 전제 아래 군축 협상을 시사하며 대화 여지를 암시한 측면이 있다고 평가했다 통일부 당국자는 이날 기자들과 만나 전날 발표된 김 부부장 담화와 관련해 새롭게 안보 우려 해소 방법을 주문한 게 ,2025-04-10 11:33:00,https://www.khan.co.kr/article/202504101133001/?utm_source=khan_rss&utm_medium=rss&utm_campaign=politic_news,경향닷컴,"['김여정', '북한', '노동당', '부부장', '조선중앙TV', '연합', '뉴스', '통일부', '10', '김여정', '북한', '노동당', '부부장', '완전', '불가', '담화', '대하', '북한', '보유국', '인정', '전제', '아래', '군축', '협상', '시사', '대화', '여지', '암시', '측면', '다고', '평가', '통일부', '당국자', '이날', '기자', '만나', '전날', '발표', '부부장', '담화', '관련', '새롭', '안보', '우려', '해소', '방법', '주문']","통일부 “김여정 담화, 군축 시사해 대화 암시···트럼프에 간접 반응” 김여정 북한 노동당 부부장 조선중앙TV연합뉴스 통일부가 10일 김여정 북한 노동당 부부장의 완전한 비핵화 불가 담화에 대해 북한의 핵보유국을 인정하는 전제 아래 군축 협상을 시사하며 대화 여지를 암시한 측면이 있다고 평가했다 통일부 당국자는 이날 기자들과 만나 전날 발표된 김 부부장 담화와 관련해 새롭게 안보 우려 해소 방법을 주문한 게 ",0
"법원 “정부, 447억 청구액 근거 명확히”…3분 만에 끝난 북한 상대 첫 손배소 재판",공동연락사무소 폭파 관련 피고 측 빈자리 상태 진행 북 대응 없으면 길어질 수도 5년 전 남북공동연락사무소를 폭파한 북한 정부에 법적 책임을 묻겠다며 한국 정부가 제기한 손해배상 소송이 본격적으로 시작됐다 서울중앙지법 민사합의46부재판장 김형철는 9일 대한민국 정부가 북한 정부를 상대로 낸 손해배상 소송의 1차 변론기일을 열었다 남,2025-04-09 20:53:00,https://www.khan.co.kr/article/202504092053025/?utm_source=khan_rss&utm_medium=rss&utm_campaign=politic_news,경향닷컴,"['공동', '연락', '사무소', '폭파', '관련', '피고', '빈자리', '상태', '진행', '대응', '으면', '길어지', '남북', '공동연락사무소', '폭파', '북한', '정부', '책임', '다며', '한국', '정부', '제기', '손해', '배상', '소송', '본격', '시작', '서울중앙지법', '민사', '합의', '46', '재판장', '김형철', '대한민국', '정부', '북한', '정부', '상대', '손해', '배상', '소송', '변론', '기일']","법원 “정부, 447억 청구액 근거 명확히”…3분 만에 끝난 북한 상대 첫 손배소 재판 공동연락사무소 폭파 관련 피고 측 빈자리 상태 진행 북 대응 없으면 길어질 수도 5년 전 남북공동연락사무소를 폭파한 북한 정부에 법적 책임을 묻겠다며 한국 정부가 제기한 손해배상 소송이 본격적으로 시작됐다 서울중앙지법 민사합의46부재판장 김형철는 9일 대한민국 정부가 북한 정부를 상대로 낸 손해배상 소송의 1차 변론기일을 열었다 남",0
"군인공제회, 산불 진화 장병에 위문금",,2025-04-10 18:30:00,https://www.hankyung.com/article/2025041040001,한국경제,,"군인공제회, 산불 진화 장병에 위문금 ",0
"유승민 ""산불 재난지원금 턱없이 부족…긴급추경 편성해야""",,2025-04-10 17:33:00,https://www.hankyung.com/article/202504103937i,한국경제,,"유승민 ""산불 재난지원금 턱없이 부족…긴급추경 편성해야"" ",0
"""소속 부처 상관 없이 하나 돼라""…한 대행 주미대사 화상회의",,2025-04-10 11:40:00,https://www.hankyung.com/article/2025041029787,한국경제,,"""소속 부처 상관 없이 하나 돼라""…한 대행 주미대사 화상회의 ",0
"[속보] 韓대행, 통상교섭본부장·주미대사와 통화…상호관세 대책 논의",,2025-04-10 11:34:00,https://www.hankyung.com/article/2025041029627,한국경제,,"[속보] 韓대행, 통상교섭본부장·주미대사와 통화…상호관세 대책 논의 ",0
"한덕수 대행 ""90일간 총력 다할 것""…미국 상호관세 유예",,2025-04-10 10:46:00,https://www.hankyung.com/article/2025041027357,한국경제,,"한덕수 대행 ""90일간 총력 다할 것""…미국 상호관세 유예 ",0
제13회 국제소방안전박람회 개최,국내 유일의 소방비즈니스 전문 행사인 lsquo제13회 국제소방안전박람회rsquo가 4월 27일부터 29일까지 3일간 대구 엑스코에서 개최된다대구시와 국민안전처가 주관하는 이번제13회 국제소방안전박람회International Fire  Safety EXPO 2016는 lsquo소방산업진흥으로 국민생활 안전 확보rsquo라는 슬로건 아래 신기술middot신제품을 전시하고 체험 및 야외시연 부스 등을 선보이는 소방안전 분야의 종합전시 마케팅장이다박람회 개최 기간 관람은 무료이며 어린이 청소년 학부모,2017-06-05 14:07:00,http://dev1.ndsoftnews.com/news/articleView.html?idxno=6,뉴스포스트,"['국내', '유일', '소방', '비즈니스', '전문', '행사', 'lsquo', '13', '국제', '소방', '안전', '박람회', 'rsquo', '27', '29', '대구', '엑스코', '개최', '다대구시', '국민', '안전처', '주관', '13', '국제', '소방', '안전', '박람회', 'International', 'Fire', 'Safety', 'EXPO', '2016', 'lsquo', '소방', '산업', '진흥', '국민', '생활', '안전', '확보', 'rsquo', '라는', '슬로건', '아래', '기술', 'middot', '제품', '전시', '체험', '야외', '시연', '부스', '선보이', '소방', '안전', '분야', '종합', '전시', '마케팅장이다', '박람회', '개최', '기간', '관람', '무료', '어린이', '청소년', '학부모']",제13회 국제소방안전박람회 개최 국내 유일의 소방비즈니스 전문 행사인 lsquo제13회 국제소방안전박람회rsquo가 4월 27일부터 29일까지 3일간 대구 엑스코에서 개최된다대구시와 국민안전처가 주관하는 이번제13회 국제소방안전박람회International Fire  Safety EXPO 2016는 lsquo소방산업진흥으로 국민생활 안전 확보rsquo라는 슬로건 아래 신기술middot신제품을 전시하고 체험 및 야외시연 부스 등을 선보이는 소방안전 분야의 종합전시 마케팅장이다박람회 개최 기간 관람은 무료이며 어린이 청소년 학부모,0
"""美 관세대응 총력""..자동차·부품 업계에 정책금융 2조 원 추가 투입",뉴스데일리정부는 미국의 자동차 관세 부과에 대응해 자동차부품 업계의 긴급 유동성 지원을 위해 2조 원의 정책금융을 추가로 투입하고 추후 소진율과 관세 파급 등을 고려해 추가 공급 여부를 검토키로 했다또 관세피해 중소기업 대상으로 긴급경영안정자금 지원을 확대하는 한편 관세 피해기업의 법인세부가가치세소득세 납부기한을 최대 9개월 연장하고 관세도 1년간 유예한다아울러 국내 시장의 수요진작을 위해 전기차 보조금 제도 운용을 당초 올 상반기에서 연말까지로 연장하고 지원비율도 2040에서 3080로 대폭 확대한다정,2025-04-10 11:49:00,http://www.newsdaily.kr/news/articleView.html?idxno=245720,뉴스데일리,"['정부', '미국', '자동차', '관세', '부과', '대응', '자동차', '부품', '업계', '긴급', '유동', '지원', '위하', '정책', '금융', '추가', '투입', '추후', '소진', '관세', '파급', '고려', '추가', '공급', '검토', '관세', '피해', '중소기업', '대상', '긴급', '경영', '안정', '자금', '지원', '확대', '한편', '관세', '피해', '기업', '법인세', '부가', '가치세', '소득세', '납부', '기한', '최대', '개월', '연장', '관세', '유예', 'ㄴ다', '국내', '시장', '수요', '진작', '위하', '전기', '보조금', '제도', '운용', '당초', '상반기', '연말', '연장', '지원', '비율', '2040', '3080', '대폭', '확대', '다정']","""美 관세대응 총력""..자동차·부품 업계에 정책금융 2조 원 추가 투입 뉴스데일리정부는 미국의 자동차 관세 부과에 대응해 자동차부품 업계의 긴급 유동성 지원을 위해 2조 원의 정책금융을 추가로 투입하고 추후 소진율과 관세 파급 등을 고려해 추가 공급 여부를 검토키로 했다또 관세피해 중소기업 대상으로 긴급경영안정자금 지원을 확대하는 한편 관세 피해기업의 법인세부가가치세소득세 납부기한을 최대 9개월 연장하고 관세도 1년간 유예한다아울러 국내 시장의 수요진작을 위해 전기차 보조금 제도 운용을 당초 올 상반기에서 연말까지로 연장하고 지원비율도 2040에서 3080로 대폭 확대한다정",0
"韓 권한대행 ""제21대 대통령 선거, 공정·투명하도록 준비에 만전""",뉴스데일리한덕수 대통령 권한대행 국무총리는 국가와 국민을 위해 우리에게 주어진 시간은 2개월 남짓 남았으며 일체의 동요 없이 오직 국민의 안전과 민생 회복 당면한 미국발 통상전쟁 대응에 마지막 소명을 다해야 한다고 강조했다한 권한대행은 이날 오전 정부서울청사에서 열린 제15회 국무회의 모두발언을 통해 지난 4개월간 국민 여러분께 혼란과 걱정을 끼쳐 드리고 대통령이 궐위되는 안타까운 상황에 직면하게 돼 진심으로 죄송하다며 이같이 말했다또한 외교부와 기재부를 중심으로 국제사회에 대한민국의 민주주의와 시스템이 굳건하게,2025-04-08 21:51:00,http://www.newsdaily.kr/news/articleView.html?idxno=245648,뉴스데일리,"['뉴스데일리한덕수', '대통령', '권한', '대행', '국무총리', '국가', '국민', '위하', '주어지', '개월', '으며', '일체', '동요', '없이', '국민', '안전', '민생', '회복', '당면', '미국', '통상', '전쟁', '대응', '마지막', '소명', 'ㄴ다고', '강조', '권한', '대행', '이날', '오전', '정부서울청사', '열리', '15', '국무', '회의', '발언', '통하', '지나', '개월', '국민', '혼란', '걱정', '끼치', '드리', '대통령', '궐위', '안타깝', '상황', '직면', '진심', '죄송하', '다며', '외교부', '기재부', '중심', '국제', '사회', '대한민국', '민주주의', '시스템', '굳건하']","韓 권한대행 ""제21대 대통령 선거, 공정·투명하도록 준비에 만전"" 뉴스데일리한덕수 대통령 권한대행 국무총리는 국가와 국민을 위해 우리에게 주어진 시간은 2개월 남짓 남았으며 일체의 동요 없이 오직 국민의 안전과 민생 회복 당면한 미국발 통상전쟁 대응에 마지막 소명을 다해야 한다고 강조했다한 권한대행은 이날 오전 정부서울청사에서 열린 제15회 국무회의 모두발언을 통해 지난 4개월간 국민 여러분께 혼란과 걱정을 끼쳐 드리고 대통령이 궐위되는 안타까운 상황에 직면하게 돼 진심으로 죄송하다며 이같이 말했다또한 외교부와 기재부를 중심으로 국제사회에 대한민국의 민주주의와 시스템이 굳건하게",0
"韓 대행 대국민 담화 ""굳건한 안보태세 유지…차기 대선 관리 최선""",뉴스데일리한덕수 대통령 권한대행 국무총리는 4일 대통령 권한대행으로서 국가 안보와 외교에 공백이 없도록 굳건한 안보태세를 유지하겠다고 말했다한 권한대행은 이날 헌법재판소의 탄핵심판 결과가 확정되자 대국민 담화를 통해 주권자인 국민 여러분들의 뜻을 받들어 헌법과 법률에 따라 다음 정부가 차질 없이 출범할 수 있도록 차기 대통령 선거관리에 최선을 다하겠다며 이같이 밝혔다그는 헌정사상 두 번째로 현직 국가원수의 탄핵이라는 불행한 상황이 발생한 것을 무겁게 생각한다고 전했다또한 통상전쟁 등 당면한 현안에 대한 대처에,2025-04-04 22:08:00,http://www.newsdaily.kr/news/articleView.html?idxno=245584,뉴스데일리,"['뉴스데일리한덕수', '대통령', '권한', '대행', '국무총리', '대통령', '권한', '대행', '국가', '안보', '외교', '공백', '도록', '굳건하', '안보', '태세', '유지', '다고', '권한', '대행', '이날', '헌법', '재판소', '탄핵', '심판', '결과', '확정', '대국민', '담화', '통하', '주권자', '국민', '받들', '헌법', '법률', '따르', '정부', '차질', '없이', '출범', '도록', '차기', '대통령', '선거', '관리', '최선', '다며', '밝히', '헌정사', '현직', '국가', '탄핵', '라는', '불행', '상황', '발생', '무겁', '생각', 'ㄴ다고', '전하', '통상', '전쟁', '당면', '현안', '대하', '대처']","韓 대행 대국민 담화 ""굳건한 안보태세 유지…차기 대선 관리 최선"" 뉴스데일리한덕수 대통령 권한대행 국무총리는 4일 대통령 권한대행으로서 국가 안보와 외교에 공백이 없도록 굳건한 안보태세를 유지하겠다고 말했다한 권한대행은 이날 헌법재판소의 탄핵심판 결과가 확정되자 대국민 담화를 통해 주권자인 국민 여러분들의 뜻을 받들어 헌법과 법률에 따라 다음 정부가 차질 없이 출범할 수 있도록 차기 대통령 선거관리에 최선을 다하겠다며 이같이 밝혔다그는 헌정사상 두 번째로 현직 국가원수의 탄핵이라는 불행한 상황이 발생한 것을 무겁게 생각한다고 전했다또한 통상전쟁 등 당면한 현안에 대한 대처에",0
"중대본 ""경북·경남 산불 주불 모두 진화…범정부 이재민 구호 등 총력 대응""",뉴스데일리고기동 중앙재난안전대책본부장행정안전부장관 직무대행은 30일 지난 21일부터 경상남도와 경상북도 지역을 중심으로 발생한 대형 산불은 관계기관의 총력 대응 끝에 경북은 지난 28일에 경남은 10일 만인 오늘 주불이 모두 진화됐다고 밝혔다고 본부장은 이날 오후 경북도청에서 주재한 울산경북경남 산불대응 중대본 제9차 회의 모두발언을 통해 이번 산불은 인명과 재산 피해 모두에 있어 역대 최대 규모의 피해가 발생한 것으로 추정된다며 이같이 설명했다그러면서 피해지역에 머물며 이재민과 현장의 목소리를 직접 듣,2025-03-31 09:50:00,http://www.newsdaily.kr/news/articleView.html?idxno=245449,뉴스데일리,"['고기동', '중앙', '재난', '안전', '대책', '본부장', '행정', '안전부', '장관', '직무', '대행', '30', '지나', '21', '경상남도', '경상북도', '지역', '중심', '발생', '대형', '산불', '관계', '기관', '총력', '대응', '경북', '지나', '28', '경남', '10', '오늘', '주불', '진화', '다고', '밝히', '다고', '본부장', '오후', '경북도청', '주재', '울산', '경북', '경남', '산불', '대응', '중대본', '회의', '발언', '통하', '산불', '인명', '재산', '피해', '역대', '최대', '규모', '피해', '발생', '추정', 'ㄴ다며', '설명', '그러', '면서', '피해', '지역', '머물', '이재민', '현장', '목소리', '직접']","중대본 ""경북·경남 산불 주불 모두 진화…범정부 이재민 구호 등 총력 대응"" 뉴스데일리고기동 중앙재난안전대책본부장행정안전부장관 직무대행은 30일 지난 21일부터 경상남도와 경상북도 지역을 중심으로 발생한 대형 산불은 관계기관의 총력 대응 끝에 경북은 지난 28일에 경남은 10일 만인 오늘 주불이 모두 진화됐다고 밝혔다고 본부장은 이날 오후 경북도청에서 주재한 울산경북경남 산불대응 중대본 제9차 회의 모두발언을 통해 이번 산불은 인명과 재산 피해 모두에 있어 역대 최대 규모의 피해가 발생한 것으로 추정된다며 이같이 설명했다그러면서 피해지역에 머물며 이재민과 현장의 목소리를 직접 듣",0
